<?xml version="1.0" encoding="UTF-8"?>
<spinwavegenie xmlns="SpinWaveGenieSchema" xmlns:swg="http://www.example.org/SpinWaveGenieSchema" xmlns:xsi="http://www.w3.org/2001/XMLSchema-instance" xsi:schemaLocation="SpinWaveGenieSchema SpinWaveGenieSchema.xsd ">
  <cell>
    <latticevectors>
      <a>5.0</a>
      <b>5.0</b>
      <c>7.071</c>
      <alpha>90.0</alpha>
      <beta>90.0</beta>
      <gamma>90.0</gamma>
    </latticevectors>
    <moments>
      <sublattice>
        <name>Fe1</name>
        <type>FE3</type>
        <moment>
          <magnitude>2.5</magnitude>
          <theta>90.0</theta>
          <phi>180.0</phi>
        </moment>
        <atomicpositions>
          <position>
            <x>0.0</x>
            <y>0.5</y>
            <z>0.5</z>
          </position>
          <position>
      	    <x>0.5</x>
      	    <y>0.0</y>
      	    <z>0.0</z>
          </position>
        </atomicpositions>
      </sublattice>
      <sublattice>
        <name>Fe2</name>
        <type>FE3</type>
        <moment>
          <magnitude>2.5</magnitude>
          <theta>90.0</theta>
          <phi>0.0</phi>
        </moment>
        <atomicpositions>
          <position>
            <x>0.0</x>
            <y>0.5</y>
            <z>0.0</z>
          </position>
          <position>
      	    <x>0.5</x>
      	    <y>0.0</y>
      	    <z>0.5</z>
          </position>
        </atomicpositions>
      </sublattice>
    </moments>    
  </cell>
  <interactions>
    <Anisotropy>
      <group>
        <direction>
          <x>1.0</x>
          <y>0.0</y>
          <z>0.0</z>
        </direction>
        <value>-0.0046</value>
    	<sublattices>
    	  <name>Fe1</name>
    	  <name>Fe2</name>
    	</sublattices>
      </group>
      <group>
        <direction>
          <x>0.0</x>
          <y>0.0</y>
          <z>1.0</z>
        </direction>
        <value>-0.0013</value>
    	<sublattices>
    	  <name>Fe1</name>
    	  <name>Fe2</name>
    	</sublattices>
      </group>        	
    </Anisotropy>   
    <Exchange>
        <group>
            <value>-4.2</value>
            <mindist>3.5</mindist>
            <maxdist>4.0</maxdist>
            <pairs>
                <pair><name1>Fe1</name1><name2>Fe2</name2></pair>
            </pairs>
        </group>
    </Exchange>
  </interactions>
</spinwavegenie>
