<?xml version="1.0" encoding="UTF-8"?>
<spinwavegenie xmlns:swg="SpinWaveGenieSchema" xmlns:xsi="http://www.w3.org/2001/XMLSchema-instance" xsi:schemaLocation="SpinWaveGenieSchema SpinWaveGenieSchema.xsd ">
  <cell>
    <latticevectors>
      <a>6.0104</a>
      <b>6.0104</b>
      <c>8.5</c>
      <alpha>90.0</alpha>
      <beta>90.0</beta>
      <gamma>90.0</gamma>
    </latticevectors>
    <moments>
      <sublattice>
        <name>Mn0</name>
        <type>MN2</type>
        <moment>
          <magnitude>2.5</magnitude>
          <theta>0.0</theta>
          <phi>0.0</phi>
        </moment>
        <atomicpositions>
          <position>
            <x>0.0</x>
            <y>0.25</y>
            <z>0.125</z>
          </position>
          <position>
          	<x>0.5</x>
          	<y>0.75</y>
          	<z>0.625</z>
          </position>
        </atomicpositions>
      </sublattice>
      <sublattice>
      	<name>Mn1</name>
      	<type>MN2</type>
      	<moment>
      		<magnitude>2.5</magnitude>
      		<theta>0.0</theta>
      		<phi>0.0</phi>
      	</moment>
      	<atomicpositions>
      		<position>
      			<x>0.5</x>
      			<y>0.25</y>
      			<z>0.375</z>
      		</position>
      		<position>
      			<x>0.0</x>
      			<y>0.75</y>
      			<z>0.875</z>
      		</position>
      	</atomicpositions>
      </sublattice>
      <sublattice>
      	<name>V0</name>
      	<type>V3</type>
      	<moment>
      		<magnitude>1.0</magnitude>
      		<theta>116.271355853</theta>
      		<phi>270.0</phi>
      	</moment>
      	<atomicpositions>
      		<position>
      			<x>0.0</x>
      			<y>0.0</y>
      			<z>0.5</z>
      		</position>
      		<position>
      			<x>0.5</x>
      			<y>0.5</y>
      			<z>0.0</z>
      		</position>
      	</atomicpositions>
      </sublattice>
      <sublattice>
      	<name>V1</name>
      	<type>V3</type>
      	<moment>
      		<magnitude>1.0</magnitude>
      		<theta>116.271355853</theta>
      		<phi>0.0</phi>
      	</moment>
      	<atomicpositions>
      		<position>
      			<x>0.75</x>
      			<y>0.25</y>
      			<z>0.75</z>
      		</position>
      		<position>
      			<x>0.25</x>
      			<y>0.75</y>
      			<z>0.25</z>
      		</position>
      	</atomicpositions>
      </sublattice>
      <sublattice>
      	<name>V2</name>
      	<type>V3</type>
      	<moment>
      		<magnitude>1.0</magnitude>
      		<theta>116.271355853</theta>
      		<phi>90.0</phi>
      	</moment>
      	<atomicpositions>
      		<position>
      			<x>0.5</x>
      			<y>0.0</y>
      			<z>0.0</z>
      		</position>
      		<position>
      			<x>0.0</x>
      			<y>0.5</y>
      			<z>0.5</z>
      		</position>
      	</atomicpositions>
      </sublattice>
      <sublattice>
      	<name>V3</name>
      	<type>V3</type>
      	<moment>
      		<magnitude>1.0</magnitude>
      		<theta>116.271355853</theta>
      		<phi>180.0</phi>
      	</moment>
      	<atomicpositions>
      		<position>
      			<x>0.75</x>
      			<y>0.75</y>
      			<z>0.25</z>
      		</position>
      		<position>
      			<x>0.25</x>
      			<y>0.25</y>
      			<z>0.75</z>
      		</position>
      	</atomicpositions>
      </sublattice>
    </moments>
  </cell>
  <interactions>
  	<Exchange>
  		<group>
  			<value>-1.8</value>
  			<mindist>3.48</mindist>
  			<maxdist>3.57</maxdist>
  			<pairs>
  				<pair>
  					<name1>Mn0</name1>
  					<name2>V0</name2>
  				</pair>
  				<pair>
  					<name1>Mn0</name1>
  					<name2>V1</name2>
  				</pair>
  				<pair>
  					<name1>Mn0</name1>
  					<name2>V2</name2>
  				</pair>
  				<pair>
  					<name1>Mn0</name1>
  					<name2>V3</name2>
  				</pair>
  				<pair>
  					<name1>Mn1</name1>
  					<name2>V0</name2>
  				</pair>
  				<pair>
  					<name1>Mn1</name1>
  					<name2>V1</name2>
  				</pair>
  				<pair>
  					<name1>Mn1</name1>
  					<name2>V2</name2>
  				</pair>
  				<pair>
  					<name1>Mn1</name1>
  					<name2>V3</name2>
  				</pair>
  			</pairs>
  		</group>
  		<group>
  			<value>-9.5</value>
  			<mindist>2.975</mindist>
  			<maxdist>3.06</maxdist>
  			<pairs>
  				<pair>
  					<name1>V0</name1>
  					<name2>V2</name2>
  				</pair>
  				<pair>
  					<name1>V1</name1>
  					<name2>V3</name2>
  				</pair>
  			</pairs>
  		</group>
  		<group>
  			<value>-3.0</value>
  			<mindist>2.975</mindist>
  			<maxdist>3.06</maxdist>
  			<pairs>
  				<pair>
  					<name1>V0</name1>
  					<name2>V1</name2>
  				</pair>
  				<pair>
  					<name1>V0</name1>
  					<name2>V3</name2>
  				</pair>
  				<pair>
  					<name1>V2</name1>
  					<name2>V1</name2>
  				</pair>
  				<pair>
  					<name1>V2</name1>
  					<name2>V3</name2>
  				</pair>
  			</pairs>
  		</group>
  	</Exchange>
  	<Anisotropy>
  		<group>
  			<value>-0.1</value>
  			<direction>
  				<x>0.0</x>
  				<y>0.0</y>
  				<z>1.0</z>
  			</direction>
  			<sublattices>
  				<name>Mn0</name>
  				<name>Mn1</name>
  			</sublattices>
  		</group>
  		<group>
  			<value>0.7</value>
  			<direction>
  				<x>0.0</x>
  				<y>0.0</y>
  				<z>1.0</z>
  			</direction>
  			<sublattices>
  				<name>V0</name>
  				<name>V1</name>
  				<name>V2</name>
  				<name>V3</name>
  			</sublattices>
  		</group>
  		<group>
  			<value>-4.8</value>
  			<direction>
  				<x>1.0</x>
  				<y>0.0</y>
  				<z>0.0</z>
  			</direction>
  			<sublattices>
  				<name>V1</name>
  				<name>V3</name>
  			</sublattices>
  		</group>
  		<group>
  			<value>-4.8</value>
  			<direction>
  				<x>0.0</x>
  				<y>1.0</y>
  				<z>0.0</z>
  			</direction>
  			<sublattices>
  				<name>V0</name>
  				<name>V2</name>
  			</sublattices>
  		</group>
  	</Anisotropy>
  </interactions>
</spinwavegenie>
