<?xml version="1.0" encoding="UTF-8"?>
<spinwavegenie xmlns:swg="SpinWaveGenieSchema" xmlns:xsi="http://www.w3.org/2001/XMLSchema-instance" xsi:schemaLocation="SpinWaveGenieSchema SpinWaveGenieSchema.xsd ">
  <cell>
    <latticevectors>
      <a>4.873</a>
      <b>4.873</b>
      <c>3.130</c>
      <alpha>90.0</alpha>
      <beta>90.0</beta>
      <gamma>90.0</gamma>
    </latticevectors>
    <moments>
      <sublattice>
        <name>Mn0</name>
        <type>MN2</type>
        <moment>
          <magnitude>2.5</magnitude>
          <theta>0.0</theta>
          <phi>0.0</phi>
        </moment>
        <atomicpositions>
          <position>
            <x>0.0</x>
            <y>0.0</y>
            <z>0.0</z>
          </position>
        </atomicpositions>
      </sublattice>
      <sublattice>
      	<name>Mn1</name>
      	<type>MN2</type>
      	<moment>
      		<magnitude>2.5</magnitude>
      		<theta>180.0</theta>
      		<phi>0.0</phi>
      	</moment>
      	<atomicpositions>
      		<position>
      			<x>0.5</x>
      			<y>0.5</y>
      			<z>0.5</z>
      		</position>
      	</atomicpositions>
      </sublattice>
    </moments>
  </cell>
  <interactions>
    <Anisotropy>
      <group>
        <value>-0.064</value>
        <direction>
          <x>0.0</x>
          <y>0.0</y>
          <z>1.0</z>
        </direction>
        <sublattices>
          <name>Mn0</name>
          <name>Mn1</name>
        </sublattices>
      </group>
    </Anisotropy>
    <Exchange>
      <group>
        <value>-0.31</value>
        <mindist>3.7</mindist>
        <maxdist>3.9</maxdist>
        <pairs>
          <pair>
            <name1>Mn0</name1>
            <name2>Mn1</name2>
          </pair>
        </pairs>
      </group>
    </Exchange>
  </interactions>
</spinwavegenie>
