<?xml version="1.0" encoding="UTF-8"?>
<spinwavegenie xmlns="SpinWaveGenieSchema" xmlns:swg="http://www.example.org/SpinWaveGenieSchema" xmlns:xsi="http://www.w3.org/2001/XMLSchema-instance" xsi:schemaLocation="SpinWaveGenieSchema SpinWaveGenieSchema.xsd ">
  <cell>
    <latticevectors>
      <a>4.2827</a>
      <b>4.2827</b>
      <c>6.1103</c>
      <alpha>90.0</alpha>
      <beta>90.0</beta>
      <gamma>120.0</gamma>
    </latticevectors>
    <moments>
      <sublattice>
        <name>Spin0</name>
        <type>NONE</type>
        <moment>
          <magnitude>2.0</magnitude>
          <theta>0.0</theta>
          <phi>0.0</phi>
        </moment>
        <atomicpositions>
          <position>
            <x>0.0</x>
            <y>0.0</y>
            <z>0.0</z>
          </position>
          <position>
            <x>0.0</x>
            <y>0.0</y>
            <z>0.5</z>
          </position>
        </atomicpositions>
      </sublattice>
    </moments>    
  </cell>
  <interactions>
      <Exchange>
        <group>
            <name>J1</name>
            <value>-0.5046023E+01</value>
            <mindist>3.0</mindist>
            <maxdist>3.1</maxdist>
            <pairs>
                <pair><name1>Spin0</name1><name2>Spin0</name2></pair>
            </pairs>
        </group>
        <group>
            <name>J2</name>
            <value>0.2653977E+01</value>
            <mindist>4.2</mindist>
            <maxdist>4.3</maxdist>
            <pairs>
                <pair><name1>Spin0</name1><name2>Spin0</name2></pair>
            </pairs>
        </group>
        <group>
            <name>J3</name>
            <value>0.2107670E+01</value>
            <mindist>5.2</mindist>
            <maxdist>5.3</maxdist>
            <pairs>
                <pair><name1>Spin0</name1><name2>Spin0</name2></pair>
            </pairs>
        </group>
    </Exchange>
  </interactions>
  <dispersion>
      <filename>MyDispersion.txt</filename>
      <filetype>
          <printposition>1</printposition>
          <printfrequency>1</printfrequency>
          <printintensity>1</printintensity>
      </filetype>
      <lines>
          <group>
              <firstpoint>
                  <x>0.0</x>
                  <y>0.0</y>
                  <z>2.0</z>
              </firstpoint>
              <lastpoint>
                  <x>1.0</x>
                  <y>0.0</y>
                  <z>2.0</z>
              </lastpoint>
              <numberpoints>101</numberpoints>
          </group>
      </lines>
  </dispersion>
</spinwavegenie>